{
  "$schema": "https://json-schema.org/draft/2020-12/schema",
  "$id": "https://brdg.kr/schemas/codex-handoff/handoff.schema.json",
  "title": "codex-handoff handoff",
  "type": "object",
  "required": [
    "schema_version",
    "project_id",
    "updated_at",
    "current_goal",
    "status_summary",
    "decisions",
    "todos",
    "related_files",
    "recent_commands"
  ],
  "properties": {
    "schema_version": {
      "type": "string"
    },
    "project_id": {
      "type": "string"
    },
    "updated_at": {
      "type": "string",
      "format": "date-time"
    },
    "repo_path": {
      "type": "string"
    },
    "active_branch": {
      "type": "string"
    },
    "current_goal": {
      "type": "string"
    },
    "status_summary": {
      "type": "string"
    },
    "next_prompt": {
      "type": "string"
    },
    "search_hints": {
      "type": "array",
      "items": {
        "type": "string"
      }
    },
    "related_files": {
      "type": "array",
      "items": {
        "type": "string"
      }
    },
    "decisions": {
      "type": "array",
      "items": {
        "type": "object",
        "required": [
          "summary"
        ],
        "properties": {
          "summary": {
            "type": "string"
          },
          "rationale": {
            "type": "string"
          },
          "timestamp": {
            "type": "string",
            "format": "date-time"
          },
          "source": {
            "type": "string"
          }
        },
        "additionalProperties": false
      }
    },
    "todos": {
      "type": "array",
      "items": {
        "type": "object",
        "required": [
          "id",
          "summary",
          "status"
        ],
        "properties": {
          "id": {
            "type": "string"
          },
          "summary": {
            "type": "string"
          },
          "status": {
            "type": "string",
            "enum": [
              "pending",
              "in_progress",
              "done",
              "blocked"
            ]
          },
          "priority": {
            "type": "string",
            "enum": [
              "low",
              "medium",
              "high"
            ]
          },
          "files": {
            "type": "array",
            "items": {
              "type": "string"
            }
          },
          "notes": {
            "type": "string"
          }
        },
        "additionalProperties": false
      }
    },
    "recent_commands": {
      "type": "array",
      "items": {
        "type": "object",
        "required": [
          "command"
        ],
        "properties": {
          "command": {
            "type": "string"
          },
          "timestamp": {
            "type": "string",
            "format": "date-time"
          },
          "purpose": {
            "type": "string"
          }
        },
        "additionalProperties": false
      }
    },
    "sessions": {
      "type": "array",
      "items": {
        "type": "object",
        "required": [
          "id",
          "path"
        ],
        "properties": {
          "id": {
            "type": "string"
          },
          "path": {
            "type": "string"
          },
          "summary": {
            "type": "string"
          },
          "tags": {
            "type": "array",
            "items": {
              "type": "string"
            }
          }
        },
        "additionalProperties": false
      }
    },
    "notes": {
      "type": "array",
      "items": {
        "type": "string"
      }
    }
  },
  "additionalProperties": false
}
