{
  "schema_version": "1.0",
  "project_id": "codex-handoff",
  "updated_at": "2026-04-07T01:15:00+09:00",
  "repo_path": "/Users/dukhyunlee/development/repos/brdg-kr/codex-handoff",
  "active_branch": "main",
  "current_goal": "Implement thread-bundle handoff sync so a user can move between machines and resume Codex work from repo-related thread data.",
  "status_summary": "The local reader CLI and Cloudflare R2 remote auth profile flow are implemented. The next milestone is repo attach plus thread discovery, thread-bundle export, background push/pull sync, and root view materialization for another machine.",
  "next_prompt": "Implement the npm installer, repo registry, local thread discovery from the Codex thread list, thread-bundle export under `.codex-handoff/threads/`, and background sync that materializes the selected thread into the root handoff view.",
  "search_hints": [
    "scene-evidence",
    "restore pack",
    "reader CLI",
    "cross-machine restore",
    "thread bundles",
    "thread discovery",
    "codex sessions",
    "agent-first install",
    "npm installer",
    "background sync"
  ],
  "related_files": [
    "AGENTS.md",
    "README.md",
    ".codex-handoff/latest.md",
    ".codex-handoff/handoff.json",
    "schemas/handoff.schema.json",
    "codex_handoff/cli.py",
    "codex_handoff/reader.py",
    "codex_handoff/r2.py",
    "codex_handoff/secrets.py",
    "docs/agent-install-ux.md",
    "docs/agent-install-prompts.md",
    "docs/npm-installer-spec.md"
  ],
  "decisions": [
    {
      "summary": "Always bootstrap from latest.md before searching raw history.",
      "rationale": "Keeps routine restore cheap and deterministic."
    },
    {
      "summary": "Treat raw jsonl as evidence that must be searched and sliced on demand.",
      "rationale": "Prevents loading the whole session transcript into Codex."
    },
    {
      "summary": "Start with a local CLI instead of an MCP server.",
      "rationale": "The CLI is simpler to ship and is enough to prove the restore model."
    },
    {
      "summary": "Use `remote` as the user-facing term for synchronized backend storage.",
      "rationale": "It keeps the backend abstraction stable while R2 is the only concrete provider."
    },
    {
      "summary": "Design the next installation layer around an npm wrapper and a background agent.",
      "rationale": "The target experience is a short Codex prompt that installs, authenticates, auto-starts, and syncs across macOS and Windows."
    },
    {
      "summary": "Scope sync by repo-attached thread bundles, not by flattening all handoff files into one remote root.",
      "rationale": "The product is for one person handing work off between machines, so the remote layout should preserve thread identity while still materializing a single active view for the existing reader."
    }
  ],
  "todos": [
    {
      "id": "todo-cli",
      "summary": "Implement status, resume, context-pack, search, and extract commands.",
      "status": "done",
      "priority": "high",
      "files": [
        "codex_handoff/cli.py",
        "codex_handoff/reader.py"
      ]
    },
    {
      "id": "todo-schema",
      "summary": "Define the handoff.json schema and keep a sample file in the repository.",
      "status": "done",
      "priority": "high",
      "files": [
        "schemas/handoff.schema.json",
        ".codex-handoff/handoff.json"
      ]
    },
    {
      "id": "todo-docs",
      "summary": "Document the AGENTS bootstrap flow and CLI usage examples.",
      "status": "done",
      "priority": "medium",
      "files": [
        "AGENTS.md",
        "README.md"
      ]
    },
    {
      "id": "todo-agent-ux",
      "summary": "Write the agent-first installer UX, npm wrapper spec, ready-to-paste install prompts, and thread-bundle sync design.",
      "status": "done",
      "priority": "high",
      "files": [
        "docs/agent-install-ux.md",
        "docs/agent-install-prompts.md",
        "docs/npm-installer-spec.md",
        "docs/thread-sync-design.md"
      ]
    },
    {
      "id": "todo-thread-sync",
      "summary": "Implement the npm installer, repo registry, local thread discovery, thread-bundle export, and background pull/push sync flow.",
      "status": "pending",
      "priority": "high",
      "files": [
        "docs/agent-install-ux.md",
        "docs/npm-installer-spec.md",
        "docs/thread-sync-design.md",
        "codex_handoff/cli.py",
        "codex_handoff/reader.py"
      ]
    }
  ],
  "recent_commands": [
    {
      "command": "python3 --version",
      "purpose": "Confirm the baseline interpreter for the zero-dependency CLI."
    },
    {
      "command": "find . -maxdepth 2 -type f | sort",
      "purpose": "Confirm the repository started empty."
    },
    {
      "command": "python3 -m unittest discover -s tests",
      "purpose": "Verify the reader CLI and R2 auth profile flow after implementation."
    }
  ],
  "sessions": [
    {
      "id": "sess-video-2026-04-06",
      "path": ".codex-handoff/raw/session-2026-04-06.jsonl",
      "summary": "Discussion about splitting latest.md, handoff.json, and raw jsonl roles.",
      "tags": [
        "bootstrap",
        "reader",
        "scene-evidence"
      ]
    }
  ],
  "notes": [
    "The reader is responsible for generating Codex-friendly context, not just copying raw files.",
    "Resume quality depends on keeping latest.md concise and handoff.json structured.",
    "The sync model should optimize for serial handoff between machines, not simultaneous editing.",
    "Thread identity must be preserved in remote storage, but the existing reader should keep consuming a single root `.codex-handoff/` view."
  ]
}
